{
  "systemId": "dnd-5e-2024",
  "systemName": "D&D 5e (2024)",
  "version": "1.0.0",

  "creationSteps": [

    {
      "stepId": "identity",
      "label": "Identity",
      "description": "Start by recording the basics: who is your character, who is playing them, and where are they in their adventuring career?",
      "fields": [
        {
          "id": "characterName",
          "label": "Character Name",
          "type": "text",
          "placeholder": "Enter your character's name..."
        },
        {
          "id": "playerName",
          "label": "Player Name",
          "type": "text",
          "placeholder": "Enter your real name..."
        },
        {
          "id": "characterLevel",
          "label": "Character Level",
          "type": "dropdown",
          "defaultValue": "1",
          "options": [
            { "value": "1",  "label": "Level 1" },
            { "value": "2",  "label": "Level 2" },
            { "value": "3",  "label": "Level 3" },
            { "value": "4",  "label": "Level 4" },
            { "value": "5",  "label": "Level 5" },
            { "value": "6",  "label": "Level 6" },
            { "value": "7",  "label": "Level 7" },
            { "value": "8",  "label": "Level 8" },
            { "value": "9",  "label": "Level 9" },
            { "value": "10", "label": "Level 10" },
            { "value": "11", "label": "Level 11" },
            { "value": "12", "label": "Level 12" },
            { "value": "13", "label": "Level 13" },
            { "value": "14", "label": "Level 14" },
            { "value": "15", "label": "Level 15" },
            { "value": "16", "label": "Level 16" },
            { "value": "17", "label": "Level 17" },
            { "value": "18", "label": "Level 18" },
            { "value": "19", "label": "Level 19" },
            { "value": "20", "label": "Level 20" }
          ]
        },
        {
          "id": "experiencePoints",
          "label": "Experience Points",
          "type": "text",
          "defaultValue": "0",
          "placeholder": "0",
          "notes": "Total XP earned. Milestone leveling games may leave this blank."
        },
        {
          "id": "background",
          "label": "Background",
          "type": "dropdown",
          "options": [
            {
              "value": "acolyte",
              "label": "Acolyte",
              "description": "You have spent your life in service to a temple. Skill Proficiencies: Insight, Religion. Languages: Two of your choice. Feat: Magic Initiate (Cleric)."
            },
            {
              "value": "artisan",
              "label": "Artisan",
              "description": "You are trained in a particular artisan's craft. Skill Proficiencies: Investigation, Persuasion. Tool Proficiency: One Artisan's Tools of your choice. Languages: One of your choice. Feat: Crafter."
            },
            {
              "value": "charlatan",
              "label": "Charlatan",
              "description": "You always had a way with people, bending the truth to your advantage. Skill Proficiencies: Deception, Sleight of Hand. Tool Proficiency: Forgery Kit. Languages: One of your choice. Feat: Skilled."
            },
            {
              "value": "criminal",
              "label": "Criminal",
              "description": "You are an experienced criminal with a history of breaking the law. Skill Proficiencies: Sleight of Hand, Stealth. Tool Proficiency: Thieves' Tools. Languages: One of your choice. Feat: Alert."
            },
            {
              "value": "entertainer",
              "label": "Entertainer",
              "description": "You thrive in front of an audience. Skill Proficiencies: Acrobatics, Performance. Tool Proficiency: Musical Instrument of your choice. Languages: One of your choice. Feat: Musician."
            },
            {
              "value": "farmer",
              "label": "Farmer",
              "description": "You grew up close to the land, learning the ways of agriculture and animal husbandry. Skill Proficiencies: Animal Handling, Nature. Tool Proficiency: Carpenter's Tools. Languages: One of your choice. Feat: Tough."
            },
            {
              "value": "guard",
              "label": "Guard",
              "description": "You served as a guard, patrol officer, or soldier in a town or city. Skill Proficiencies: Athletics, Perception. Tool Proficiency: Gaming Set of your choice. Languages: One of your choice. Feat: Alert."
            },
            {
              "value": "guide",
              "label": "Guide",
              "description": "You grew up in the wilderness, learning to survive far from civilization. Skill Proficiencies: Stealth, Survival. Tool Proficiency: Cartographer's Tools. Languages: One of your choice. Feat: Musician."
            },
            {
              "value": "hermit",
              "label": "Hermit",
              "description": "You lived in seclusion for a long period of time. Skill Proficiencies: Medicine, Religion. Tool Proficiency: Herbalism Kit. Languages: One of your choice. Feat: Magic Initiate (Druid)."
            },
            {
              "value": "merchant",
              "label": "Merchant",
              "description": "You worked in commerce, buying and selling goods across the land. Skill Proficiencies: Animal Handling, Persuasion. Tool Proficiency: Navigator's Tools. Languages: One of your choice. Feat: Lucky."
            },
            {
              "value": "noble",
              "label": "Noble",
              "description": "You understand wealth, power, and privilege. Skill Proficiencies: History, Persuasion. Tool Proficiency: Gaming Set of your choice. Languages: One of your choice. Feat: Skilled."
            },
            {
              "value": "sailor",
              "label": "Sailor",
              "description": "You sailed on a seagoing vessel for years. Skill Proficiencies: Acrobatics, Perception. Tool Proficiency: Navigator's Tools. Languages: One of your choice. Feat: Tavern Brawler."
            },
            {
              "value": "sage",
              "label": "Sage",
              "description": "You spent years learning the lore of the multiverse. Skill Proficiencies: Arcana, History. Languages: Two of your choice. Feat: Magic Initiate (Wizard)."
            },
            {
              "value": "scribe",
              "label": "Scribe",
              "description": "You spent years as a clerk or copyist. Skill Proficiencies: Investigation, Perception. Tool Proficiency: Calligrapher's Supplies. Languages: One of your choice. Feat: Skilled."
            },
            {
              "value": "soldier",
              "label": "Soldier",
              "description": "War has been your life for as long as you care to remember. Skill Proficiencies: Athletics, Intimidation. Tool Proficiency: Gaming Set of your choice. Languages: One of your choice. Feat: Savage Attacker."
            },
            {
              "value": "wayfarer",
              "label": "Wayfarer",
              "description": "You grew up on the road, traveling from place to place without a fixed home. Skill Proficiencies: Insight, Stealth. Tool Proficiency: Thieves' Tools. Languages: One of your choice. Feat: Lucky."
            }
          ]
        }
      ]
    },

    {
      "stepId": "species",
      "label": "Species",
      "description": "Choose your character's species. Each species grants unique traits that persist throughout your adventuring career. Source: PHB 2024.",
      "fields": [
        {
          "id": "species",
          "label": "Species",
          "type": "dropdown",
          "options": [
            {
              "value": "aasimar",
              "label": "Aasimar",
              "description": "Blessed with a touch of the divine, aasimar carry a spark of celestial power. Traits: Darkvision 60 ft., Celestial Resistance (necrotic and radiant), Healing Hands, Light Bearer. At level 3 choose a Transformation: Heavenly Wings, Inner Radiance, or Necrotic Shroud."
            },
            {
              "value": "dragonborn",
              "label": "Dragonborn",
              "description": "Born of dragon lineage, dragonborn carry draconic gifts. Choose an Ancestor from the 10 dragon types. Traits: Draconic Ancestry (damage type), Breath Weapon (Dex save, scales with level), Damage Resistance (matching ancestry), Darkvision 60 ft."
            },
            {
              "value": "dwarf",
              "label": "Dwarf",
              "description": "Stout and sturdy denizens of mountain halls and subterranean cities. Traits: Darkvision 120 ft., Dwarven Resilience (poison resistance and Adv. on poison saves), Dwarven Toughness (+1 HP per level), Stonecunning (Tremorsense 60 ft. for 10 min via Bonus Action)."
            },
            {
              "value": "elf",
              "label": "Elf",
              "description": "Long-lived and magical, elves embody grace and ancient power. Choose a lineage: Drow, High Elf, or Wood Elf. Traits: Darkvision 60 ft., Fey Ancestry (Adv. vs. Charmed, immune to magic sleep), Keen Senses (Perception proficiency), Trance (rest in 4 hours), Lineage trait."
            },
            {
              "value": "gnome",
              "label": "Gnome",
              "description": "Small and clever, gnomes delight in invention and magic. Choose a lineage: Forest Gnome or Rock Gnome. Traits: Darkvision 60 ft., Gnomish Cunning (Adv. on Int/Wis/Cha saves vs. magic), Lineage trait."
            },
            {
              "value": "goliath",
              "label": "Goliath",
              "description": "Towering wanderers of mountain peaks, goliaths are imbued with elemental power. Choose a Giant Ancestor (Cloud, Fire, Frost, Hill, Stone, or Storm). Traits: Large Form (can be Large size, once per long rest), Powerful Build (counts as one size larger for carry), Giant Ancestry power."